{
  "schema": "melography.stock-profile",
  "id": "soft-pastel-160",
  "display_name": "Soft Pastel 160",
  "profile_version": 1,
  "provenance": "artist-authored",
  "confidence": "medium",
  "input_assumption": "neutral-camera-jpeg",
  "polarity": "negative",
  "layers": "color",
  "crop_rule": "fit-width",
  "m_exc": [0.97, 0.06, 0.03, 0.06, 1.0, 0.06, 0.04, 0.06, 0.97],
  "crosstalk": [0.0, 0.11, 0.05, 0.09, 0.0, 0.10, 0.05, 0.09, 0.0],
  "curves": [
    { "log_e": [-4.0, -3.0, -2.0, -1.0, 0.0, 0.5], "density": [0.03, 0.05, 0.22, 0.52, 0.85, 0.92] },
    { "log_e": [-4.0, -3.0, -2.0, -1.0, 0.0, 0.5], "density": [0.04, 0.07, 0.25, 0.56, 0.88, 0.95] },
    { "log_e": [-4.0, -3.0, -2.0, -1.0, 0.0, 0.5], "density": [0.05, 0.08, 0.27, 0.59, 0.90, 0.97] }
  ],
  "d_min": [0.03, 0.04, 0.05],
  "mid_log_e": -1.7,
  "x_floor": 1e-5,
  "halation": [
    { "alpha": 0.012, "kernel": [{ "sigma_mm": 0.010, "weight": 1.0 }] },
    { "alpha": 0.005, "kernel": [{ "sigma_mm": 0.008, "weight": 1.0 }] },
    { "alpha": 0.0, "kernel": [{ "sigma_mm": 0.006, "weight": 1.0 }] }
  ],
  "halation_epsilon": 0.05,
  "grain": {
    "cells_per_mm": 64,
    "lambda": 0.8,
    "mu_r_mm": 0.0040,
    "sigma_r_mm": 0.0016,
    "sigma_curve": { "density": [0.0, 0.4, 0.9, 1.6], "sigma": [0.006, 0.014, 0.018, 0.010] },
    "psd_slope": -0.92,
    "rho": [1.0, 0.45, 0.30, 0.45, 1.0, 0.40, 0.30, 0.40, 1.0],
    "seed": 162
  },
  "print": {
    "default_path": "paper",
    "d_mask": [0.04, 0.16, 0.34],
    "paper_curves": [
      { "log_e": [-3.4, -2.6, -1.8, -1.1, -0.5, -0.15], "density": [0.02, 0.03, 0.18, 0.85, 1.70, 1.90] },
      { "log_e": [-3.4, -2.6, -1.8, -1.1, -0.5, -0.15], "density": [0.02, 0.04, 0.20, 0.88, 1.72, 1.92] },
      { "log_e": [-3.4, -2.6, -1.8, -1.1, -0.5, -0.15], "density": [0.03, 0.05, 0.24, 0.92, 1.75, 1.94] }
    ],
    "paper_white_density": 0.02,
    "scanner_black": -3.0,
    "scanner_white": -0.2,
    "scanner_gamma": 0.9,
    "scanner_matrix": [0.98, 0.02, 0.0, 0.02, 1.0, 0.02, 0.0, 0.02, 1.02],
    "scanner_glare": 0.004,
    "output_matrix": [0.98, 0.03, 0.0, 0.03, 1.0, 0.03, 0.0, 0.03, 1.02]
  },
  "physical_references": [
    "Newson et al. (IEEE TIP 2017): grain model form only",
    "Low-speed fine-grain conventions from standard sensitometry literature; no manufacturer data used"
  ],
  "calibration": null,
  "license": "GPL-3.0-or-later (MELOGRAPHY project) — parameters authored for this project",
  "provenance_text": "Artist-authored: low-contrast pastel portrait look — soft shoulder, low saturation via inter-layer crosstalk, fine grain. No measured calibration."
}
